Place,Competition,Country,Start Date,End Date,Part. Score,P.S. Place,Result Score,R.S. Place,W.R. Score,Comp. Score
1,"Wanda Diamond League Xiamen, Egret Stadium, Xiamen",CHN,20 APR 2024,20 APR 2024,6440,1.0,86136,1,120,92696
2,"Yangtze Delta Athletics Diamond Gala, Suzhou Olympic Sports Centre, Suzhou",CHN,27 APR 2024,27 APR 2024,6400,2.0,85436,5,0,91836
3,"Seashore Group Doha Meeting, Suhaim bin Hamad Stadium, Doha",QAT,10 MAY 2024,10 MAY 2024,5675,3.0,85966,3,0,91641
4,"Tom Jones Memorial, Percy Beard Track, Gainesville, FL",USA,12 APR 2024,13 APR 2024,2310,6.0,86012,2,0,88322
5,"Jamaica Athletics Invitational Meet, National Stadium, Kingston",JAM,11 MAY 2024,11 MAY 2024,3125,4.0,83913,6,0,87038
6,"Southeastern Conference Outdoor Track & Field Championships, Percy Beard Track, Gainesville, FL",USA,09 MAY 2024,11 MAY 2024,1030,16.0,85862,4,0,86892
7,"Kip Keino Classic, Nyayo National Stadium, Nairobi",KEN,20 APR 2024,20 APR 2024,2605,5.0,83622,9,0,86227
8,"Clyde Littlefield Texas Relays presented by Truist, Mike A. Myers Stadium, Austin, TX",USA,27 MAR 2024,30 MAR 2024,1305,11.0,83819,7,0,85124
9,"LSU Invitational, LSU Bernie Moore Stadium, Baton Rouge, LA",USA,27 APR 2024,27 APR 2024,1230,12.0,83683,8,0,84913
10,"Mt. SAC Relays, Hilmer Lodge Stadium, Walnut, CA",USA,17 APR 2024,20 APR 2024,1430,10.0,83087,11,0,84517
11,"Pepsi Florida Relays, Percy Beard Track, Gainesville, FL",USA,29 MAR 2024,30 MAR 2024,795,20.0,83536,10,0,84331
12,"13th Savona International Meeting, Centro Sportivo Fontanassa, Savona",ITA,15 MAY 2024,15 MAY 2024,1225,13.0,82124,13,0,83349
13,"Bryan Clay Invitational, Cougar Athletic Stadium, Azusa, CA",USA,11 APR 2024,13 APR 2024,920,18.0,82012,14,0,82932
14,"LSU Alumni Gold, LSU Bernie Moore Stadium, Baton Rouge, LA",USA,20 APR 2024,20 APR 2024,930,17.0,81833,15,0,82763
15,"Battle on the Bayou, LSU Bernie Moore Stadium, Baton Rouge, LA",USA,29 MAR 2024,30 MAR 2024,465,38.0,82292,12,0,82757
16,"Miramar Invitational, Ansin Sports Complex, Miramar, FL",USA,06 APR 2024,06 APR 2024,1695,8.0,81011,18,0,82706
17,"The Penn Relay Carnival, Franklin Field, Philadelphia, PA",USA,25 APR 2024,27 APR 2024,690,26.0,81784,16,0,82474
18,"USATF Throws Festival, Univ. of Arizona Roy P. Drachman Stadium, Tucson, AZ",USA,04 MAY 2024,04 MAY 2024,1965,7.0,80041,24,0,82006
19,"Meeting Iberoamericano Huelva 2024, Estadio Iberoamericano, Huelva",ESP,30 APR 2024,30 APR 2024,1155,15.0,80434,22,0,81589
20,"Desert Heat Classic, Univ. of Arizona Roy P. Drachman Stadium, Tucson, AZ",USA,27 APR 2024,27 APR 2024,300,59.0,81171,17,0,81471
21,"East Coast Relays, University of North Florda Jax Track at Hodges Stadium, Jacksonville, FL",USA,26 APR 2024,27 APR 2024,820,19.0,80640,21,0,81460
22,"11th Kinami Michitaka Memorial Athletics Meet, Yanmar Stadium Nagai, Osaka",JPN,12 MAY 2024,12 MAY 2024,555,33.0,80733,20,0,81288
23,"Big Ten Outdoor Track & Field Championships, University of Michigan Outdoor Track Stadium, Ann Arbor, MI",USA,10 MAY 2024,12 MAY 2024,350,50.0,80922,19,0,81272
24,"Maurie Plant Meet, Lakeside Stadium, Melbourne",AUS,15 FEB 2024,15 FEB 2024,1460,9.0,79614,29,0,81074
25,"Texas Invitational, Mike A. Myers Stadium, Austin, TX",USA,26 APR 2024,27 APR 2024,515,34.0,80166,23,0,80681
26,"UAE Athletics Grand Prix, Dubai Police Club Stadium, Dubai",UAE,03 MAY 2024,03 MAY 2024,700,24.0,79900,26,0,80600
27,"Sydney Track Classic, ES Marks Athletics Field, Sydney",AUS,23 MAR 2024,23 MAR 2024,570,31.0,79897,27,0,80467
28,"Felix Sanchez Classic, Estadio Luguelín Santos, Bayaguana",DOM,20 APR 2024,20 APR 2024,420,39.0,80025,25,0,80445
29,"Adelaide Invitational, SA Athletic Stadium, Adelaide",AUS,10 FEB 2024,10 FEB 2024,730,21.0,79659,28,0,80389
30,"Bermuda Grand Prix, Flora Duffy Stadium, Devonshire",BER,28 APR 2024,28 APR 2024,1200,14.0,79122,36,0,80322
31,"58th Oda Mikio Memorial, Municipal Stadium, Hiroshima",JPN,29 APR 2024,29 APR 2024,625,28.0,79544,30,0,80169
32,"National Athletics Grand Prix 2, HOC Stadium, Hangzhou",CHN,13 APR 2024,14 APR 2024,615,30.0,79243,34,0,79858
33,"ASA Athletics Grand Prix 3 / Continental Tour Challenger, UJ Stadium, Johannesburg",RSA,27 MAR 2024,27 MAR 2024,505,35.0,79175,35,0,79680
34,"PURE Athletics Sprint Elite Meet, National Training Center, Clermont, FL",USA,11 MAY 2024,11 MAY 2024,295,62.0,79258,33,0,79553
35,"Stanford Invitational, Cobb Track and Angell Field, Palo Alto, CA",USA,29 MAR 2024,30 MAR 2024,240,71.0,79295,32,0,79535
36,"Trials for African Games 2024, Nyayo National Stadium, Nairobi",KEN,05 MAR 2024,06 MAR 2024,715,23.0,78802,39,0,79517
37,"Raleigh Relays, Paul Derr TF Facility, Raleigh, NC",USA,28 MAR 2024,30 MAR 2024,85,145.0,79400,31,0,79485
38,"Wake Forest Invitational, Kentner Stadium Wake Forest University, Winston Salem, NC",USA,19 APR 2024,19 APR 2024,135,110.0,79061,37,0,79196
39,"Canberra Track Classic, AIS Athletics Track, Canberra",AUS,01 MAR 2024,02 MAR 2024,345,51.0,78829,38,0,79174
40,"Hurricane Invitational, UMiami Cobb Stadium, Coral Gables, FL",USA,15 MAR 2024,16 MAR 2024,420,39.0,78509,42,0,78929
41,"Texas Tech Corky/Crofoot Shootout, Terry & Linda Fuller T&F Complex, Lubbock, TX",USA,26 APR 2024,27 APR 2024,145,101.0,78665,41,0,78810
42,"Hurricane Alumni Invitational, UMiami Cobb Stadium, Coral Gables, FL",USA,05 APR 2024,06 APR 2024,415,43.0,78349,46,0,78764
43,"USF Alumni Invitational, University of South Florida Track & Field Stadium, Tampa, FL",USA,15 MAR 2024,16 MAR 2024,35,222.0,78708,40,0,78743
44,"44 Farms Team Invitational, Cushing Stadium, College Station, TX",USA,05 APR 2024,06 APR 2024,225,73.0,78479,44,0,78704
45,"Virginia Challenge, UVA Lanningan Field, Charlottesville, VA",USA,19 APR 2024,20 APR 2024,245,70.0,78430,45,0,78675
46,"39th Shizuoka International Athletics Meet, Prefectural Shizuoka Stadium, Fukuroi",JPN,03 MAY 2024,03 MAY 2024,405,46.0,78187,49,0,78592
47,"Duke Invitational, Morris Williams T&F Stadium, Durham, NC",USA,11 APR 2024,13 APR 2024,75,161.0,78500,43,0,78575
48,"Occidental Invitational, Jack Kemp Stadium, Los Angeles, CA",USA,04 MAY 2024,04 MAY 2024,340,53.0,78223,47,0,78563
49,"National Athletics Grand Prix 3, Sports Center, Bengbu",CHN,09 MAY 2024,10 MAY 2024,505,35.0,78052,53,0,78557
50,"Texas A&M Alumni Muster, Cushing Stadium, College Station, TX",USA,20 APR 2024,20 APR 2024,180,85.0,78136,51,0,78316
51,"Franson Last Chance, Cougar Athletic Stadium, Azusa, CA",USA,09 MAY 2024,11 MAY 2024,85,145.0,78211,48,0,78296
52,"National Athletics Grand Prix 1, Zhaoqing Sports Center, Zhaoqing",CHN,09 APR 2024,10 APR 2024,340,53.0,77926,58,0,78266
53,"John McDonnell Invitational, John McDonnell Field, Fayetteville, AR",USA,18 APR 2024,19 APR 2024,85,145.0,78164,50,0,78249
54,"Beach Invitational, Jack Rose Track, Long Beach, CA",USA,12 APR 2024,13 APR 2024,280,65.0,77968,56,0,78248
55,"Michael Johnson Invitational, Clyde Hart Track & Field Stadium, Waco, TX",USA,19 APR 2024,20 APR 2024,160,92.0,78039,54,0,78199
56,"Bobcat Invitational, Bobcat Track and Field Complex, San Marcos, TX",USA,28 MAR 2024,30 MAR 2024,105,128.0,78034,55,0,78139
57,"Crimson Tide Invitational, Sam Bailey Track Stadium, Tuscaloosa, AL",USA,05 APR 2024,06 APR 2024,65,169.0,78054,52,0,78119
58,"ASA Athletics Grand Prix 2, Bestmed Tuks Stadium, Pretoria",RSA,18 MAR 2024,18 MAR 2024,195,81.0,77884,59,0,78079
59,"Troféu Adhemar Ferreira da Silva Loterias Caixa de Atletismo, CNDA, Bragança Paulista",BRA,05 APR 2024,07 APR 2024,410,44.0,77626,63,0,78036
60,"Sun Belt Conference Outdoor Track and Field Championships, UL Monroe Brown Stadium, Monroe, LA",USA,09 MAY 2024,11 MAY 2024,35,222.0,77958,57,0,77993
61,"Arkansas Twilight, John McDonnell Field, Fayetteville, AR",USA,03 MAY 2024,03 MAY 2024,210,77.0,77704,60,0,77914
62,"ASA Athletics Grand Prix 1, McArthur Stadium, Potchefstroom",RSA,14 MAR 2024,14 MAR 2024,420,39.0,77488,68,0,77908
63,"Arizona Spring Break Fiesta, Univ. of Arizona Roy P. Drachman Stadium, Tucson, AZ",USA,16 MAR 2024,16 MAR 2024,140,102.0,77637,62,0,77777
64,"South Florida Invitational, University of South Florida Track & Field Stadium, Tampa, FL",USA,05 APR 2024,06 APR 2024,185,83.0,77518,67,0,77703
65,"UCF Black & Gold Invite, UCF Soccer and Track Complex, Orlando, FL",USA,15 MAR 2024,16 MAR 2024,30,240.0,77643,61,0,77673
66,"Willie Williams Classic, Univ. of Arizona Roy P. Drachman Stadium, Tucson, AZ",USA,22 MAR 2024,23 MAR 2024,80,153.0,77570,65,0,77650
67,"CAA Outdoor Track and Field Championships, Elon University’s Irwin Belk Track, Elon, NC",USA,10 MAY 2024,11 MAY 2024,10,318.0,77623,64,0,77633
68,"Clyde Hart Classic, Clyde Hart Track & Field Stadium, Waco, TX",USA,22 MAR 2024,23 MAR 2024,95,137.0,77537,66,0,77632
69,"International Track Meet, Nga Puna Wai Sports Hub, Christchurch",NZL,24 FEB 2024,24 FEB 2024,730,21.0,76829,79,0,77559
70,"3rd AK Track And Field Weekend Meeting, Nyayo National Stadium, Nairobi",KEN,26 JAN 2024,27 JAN 2024,310,56.0,77245,73,0,77555
71,"4th Alexandrino Meeting - Georgios Pantos Memorial, Municipal Sports Center, Alexandria",GRE,08 MAY 2024,08 MAY 2024,345,51.0,77191,75,0,77536
72,"Georgia Tech Invitational, Geroge C. Griffin Track, Atlanta, GA",USA,19 APR 2024,20 APR 2024,205,79.0,77281,72,0,77486
73,"Pacific Coast Invitational, Jack Rose Track, Long Beach, CA",USA,11 APR 2024,11 APR 2024,120,122.0,77353,71,0,77473
74,"Ivy League Heptagonal Outdoor Track and Field Championships, Weaver Stadium, Princeton, NJ",USA,04 MAY 2024,05 MAY 2024,30,240.0,77436,70,0,77466
75,"UIL Texas State Championships, Mike A. Myers Stadium, Austin, TX",USA,02 MAY 2024,05 MAY 2024,0,,77462,69,0,77462
76,"Sir Graeme Douglas Memorial Track Classic, Douglas Track & Field, Auckland",NZL,10 MAR 2024,10 MAR 2024,560,32.0,76891,78,0,77451
77,"Keyth Talley Invitational, LSU Bernie Moore Stadium, Baton Rouge, LA",USA,23 MAR 2024,23 MAR 2024,130,112.0,77209,74,0,77339
78,"Finales des Championnats de France des Clubs, Stade des Maradas, Cergy-Pontoise",FRA,12 MAY 2024,12 MAY 2024,490,37.0,76802,81,0,77292
79,"Jim Click Shootout & Multis, Univ. of Arizona Roy P. Drachman Stadium, Tucson, AZ",USA,05 APR 2024,06 APR 2024,130,112.0,77071,76,0,77201
80,"Hurricane Collegiate Invitational, UMiami Cobb Stadium, Coral Gables, FL",USA,23 MAR 2024,23 MAR 2024,265,69.0,76764,82,0,77029
81,"Music City Challenge, Vanderbilt Track, Nashville, TN",USA,26 APR 2024,27 APR 2024,85,145.0,76900,77,0,76985
82,"UCF Knights Invite, UCF Soccer and Track Complex, Orlando, FL",USA,22 MAR 2024,23 MAR 2024,60,178.0,76815,80,0,76875
83,"Jim Green Invitational, Un. of Kentucky Outdoor Track Facility, Lexington, KY",USA,19 APR 2024,20 APR 2024,90,140.0,76454,83,0,76544
84,"72nd Hyogo Relay Carnival, Universiade Commemorative Stadium, Kobe",JPN,20 APR 2024,21 APR 2024,330,55.0,76193,86,0,76523
85,"Clark Wood Invitational, Cardinal Park, Louisville, KY",USA,26 APR 2024,27 APR 2024,140,102.0,76370,84,0,76510
86,"UC San Diego Triton Invitational, Triton Stadium, San Diego, CA",USA,05 APR 2024,06 APR 2024,410,44.0,76077,87,0,76487
87,"2nd AK Track & Field Weekend Meeting/AK Relay Series, Ulinzi Sports Complex, Langata, Nairobi",KEN,05 JAN 2024,06 JAN 2024,105,128.0,76347,85,0,76452
88,"Puma Nitro Lange Laufnacht, Carl-Kaufmann-Stadion, Karlsruhe",GER,11 MAY 2024,11 MAY 2024,420,39.0,75828,89,0,76248
89,"Canarias Athletics Invitational, Centro de Atletismo de Tenerife, Santa Cruz de Tenerife",ESP,15 MAY 2024,15 MAY 2024,700,24.0,75434,98,0,76134
90,"Belfast Irish Milers Meet In Association with Tripadvisor, Mary Peters Track, Belfast",GBR,11 MAY 2024,11 MAY 2024,50,191.0,76017,88,0,76067
91,"Velocity Fest 15, Jamaica College Ashenheim Stadium, Kingston",JAM,20 APR 2024,20 APR 2024,300,59.0,75677,90,0,75977
92,"Cameron Burrell Alumni Invitational, Carl Lewis TF and Soccer Complex, Houston, TX",USA,06 APR 2024,06 APR 2024,305,57.0,75626,92,0,75931
93,"Aztec Invitational, San Diego State University, San Diego, CA",USA,21 MAR 2024,23 MAR 2024,270,67.0,75472,96,0,75742
94,"1. kolo extraligy mužů a žen, Stadion Juliska, Praha",CZE,11 MAY 2024,11 MAY 2024,220,75.0,75486,95,0,75706
95,"AGN League 3, Pilditch Stadium, Pretoria",RSA,10 FEB 2024,10 FEB 2024,140,102.0,75547,94,0,75687
96,"Missouri Valley Conference Outdoor Track and Field Championship, Gibson Track & Field Complex, Terre Haute, IN",USA,10 MAY 2024,12 MAY 2024,5,353.0,75652,91,0,75657
97,"The Summit League Track and Field Championships, St. Thomas O'Shaughnessy Stadium, St. Paul, MN",USA,09 MAY 2024,11 MAY 2024,10,318.0,75586,93,0,75596
98,"19. Memorial Matica Šuštaršiča in Patrika Cvetana, Športni center, Kranj",SLO,11 MAY 2024,11 MAY 2024,185,83.0,75342,100,0,75527
99,"Texas A&M Invitational, Cushing Stadium, College Station, TX",USA,23 MAR 2024,23 MAR 2024,80,153.0,75443,97,0,75523
100,"18th Spring Break Classic, Pista Basilio Rodriguez, Carolina",PUR,14 MAR 2024,16 MAR 2024,195,81.0,75318,101,0,75513
