Place,Competition,Country,Start Date,End Date,Part. Score,P.S. Place,Result Score,R.S. Place,W.R. Score,Comp. Score
1,"Wanda Diamond League Xiamen, Egret Stadium, Xiamen",CHN,20 APR 2024,20 APR 2024,6440,1.0,86136,1,120,92696
2,"Yangtze Delta Athletics Diamond Gala, Suzhou Olympic Sports Centre, Suzhou",CHN,27 APR 2024,27 APR 2024,6400,2.0,85436,5,0,91836
3,"Seashore Group Doha Meeting, Suhaim bin Hamad Stadium, Doha",QAT,10 MAY 2024,10 MAY 2024,5675,3.0,85966,3,0,91641
4,"Tom Jones Memorial, Percy Beard Track, Gainesville, FL",USA,12 APR 2024,13 APR 2024,2310,6.0,86012,2,0,88322
5,"Jamaica Athletics Invitational Meet, National Stadium, Kingston",JAM,11 MAY 2024,11 MAY 2024,3125,4.0,83913,6,0,87038
6,"Southeastern Conference Outdoor Track & Field Championships, Percy Beard Track, Gainesville, FL",USA,09 MAY 2024,11 MAY 2024,1030,15.0,85862,4,0,86892
7,"Kip Keino Classic, Nyayo National Stadium, Nairobi",KEN,20 APR 2024,20 APR 2024,2605,5.0,83622,9,0,86227
8,"Clyde Littlefield Texas Relays presented by Truist, Mike A. Myers Stadium, Austin, TX",USA,27 MAR 2024,30 MAR 2024,1305,11.0,83819,7,0,85124
9,"LSU Invitational, LSU Bernie Moore Stadium, Baton Rouge, LA",USA,27 APR 2024,27 APR 2024,1230,12.0,83683,8,0,84913
10,"Mt. SAC Relays, Hilmer Lodge Stadium, Walnut, CA",USA,17 APR 2024,20 APR 2024,1430,10.0,83087,11,0,84517
11,"Pepsi Florida Relays, Percy Beard Track, Gainesville, FL",USA,29 MAR 2024,30 MAR 2024,795,19.0,83536,10,0,84331
12,"Bryan Clay Invitational, Cougar Athletic Stadium, Azusa, CA",USA,11 APR 2024,13 APR 2024,920,17.0,82012,13,0,82932
13,"LSU Alumni Gold, LSU Bernie Moore Stadium, Baton Rouge, LA",USA,20 APR 2024,20 APR 2024,930,16.0,81833,14,0,82763
14,"Battle on the Bayou, LSU Bernie Moore Stadium, Baton Rouge, LA",USA,29 MAR 2024,30 MAR 2024,465,36.0,82292,12,0,82757
15,"Miramar Invitational, Ansin Sports Complex, Miramar, FL",USA,06 APR 2024,06 APR 2024,1695,8.0,81011,17,0,82706
16,"The Penn Relay Carnival, Franklin Field, Philadelphia, PA",USA,25 APR 2024,27 APR 2024,690,24.0,81784,15,0,82474
17,"USATF Throws Festival, Univ. of Arizona Roy P. Drachman Stadium, Tucson, AZ",USA,04 MAY 2024,04 MAY 2024,1965,7.0,80041,23,0,82006
18,"Meeting Iberoamericano Huelva 2024, Estadio Iberoamericano, Huelva",ESP,30 APR 2024,30 APR 2024,1155,14.0,80434,21,0,81589
19,"Desert Heat Classic, Univ. of Arizona Roy P. Drachman Stadium, Tucson, AZ",USA,27 APR 2024,27 APR 2024,300,57.0,81171,16,0,81471
20,"East Coast Relays, University of North Florda Jax Track at Hodges Stadium, Jacksonville, FL",USA,26 APR 2024,27 APR 2024,820,18.0,80640,20,0,81460
21,"11th Kinami Michitaka Memorial Athletics Meet, Yanmar Stadium Nagai, Osaka",JPN,12 MAY 2024,12 MAY 2024,555,31.0,80733,19,0,81288
22,"Big Ten Outdoor Track & Field Championships, University of Michigan Outdoor Track Stadium, Ann Arbor, MI",USA,10 MAY 2024,12 MAY 2024,350,48.0,80922,18,0,81272
23,"Maurie Plant Meet, Lakeside Stadium, Melbourne",AUS,15 FEB 2024,15 FEB 2024,1460,9.0,79614,28,0,81074
24,"Texas Invitational, Mike A. Myers Stadium, Austin, TX",USA,26 APR 2024,27 APR 2024,515,32.0,80166,22,0,80681
25,"UAE Athletics Grand Prix, Dubai Police Club Stadium, Dubai",UAE,03 MAY 2024,03 MAY 2024,700,23.0,79900,25,0,80600
26,"Sydney Track Classic, ES Marks Athletics Field, Sydney",AUS,23 MAR 2024,23 MAR 2024,570,29.0,79897,26,0,80467
27,"Felix Sanchez Classic, Estadio Luguelín Santos, Bayaguana",DOM,20 APR 2024,20 APR 2024,420,37.0,80025,24,0,80445
28,"Adelaide Invitational, SA Athletic Stadium, Adelaide",AUS,10 FEB 2024,10 FEB 2024,730,20.0,79659,27,0,80389
29,"Bermuda Grand Prix, Flora Duffy Stadium, Devonshire",BER,28 APR 2024,28 APR 2024,1200,13.0,79122,35,0,80322
30,"58th Oda Mikio Memorial, Municipal Stadium, Hiroshima",JPN,29 APR 2024,29 APR 2024,625,26.0,79544,29,0,80169
31,"National Athletics Grand Prix 2, HOC Stadium, Hangzhou",CHN,13 APR 2024,14 APR 2024,615,28.0,79243,33,0,79858
32,"ASA Athletics Grand Prix 3 / Continental Tour Challenger, UJ Stadium, Johannesburg",RSA,27 MAR 2024,27 MAR 2024,505,33.0,79175,34,0,79680
33,"PURE Athletics Sprint Elite Meet, National Training Center, Clermont, FL",USA,11 MAY 2024,11 MAY 2024,295,60.0,79258,32,0,79553
34,"Stanford Invitational, Cobb Track and Angell Field, Palo Alto, CA",USA,29 MAR 2024,30 MAR 2024,240,68.0,79295,31,0,79535
35,"Trials for African Games 2024, Nyayo National Stadium, Nairobi",KEN,05 MAR 2024,06 MAR 2024,715,22.0,78802,38,0,79517
36,"Raleigh Relays, Paul Derr TF Facility, Raleigh, NC",USA,28 MAR 2024,30 MAR 2024,85,140.0,79400,30,0,79485
37,"Wake Forest Invitational, Kentner Stadium Wake Forest University, Winston Salem, NC",USA,19 APR 2024,19 APR 2024,135,106.0,79061,36,0,79196
38,"Canberra Track Classic, AIS Athletics Track, Canberra",AUS,01 MAR 2024,02 MAR 2024,345,49.0,78829,37,0,79174
39,"Hurricane Invitational, UMiami Cobb Stadium, Coral Gables, FL",USA,15 MAR 2024,16 MAR 2024,420,37.0,78509,41,0,78929
40,"Texas Tech Corky/Crofoot Shootout, Terry & Linda Fuller T&F Complex, Lubbock, TX",USA,26 APR 2024,27 APR 2024,145,97.0,78665,40,0,78810
41,"Hurricane Alumni Invitational, UMiami Cobb Stadium, Coral Gables, FL",USA,05 APR 2024,06 APR 2024,415,41.0,78349,45,0,78764
42,"USF Alumni Invitational, University of South Florida Track & Field Stadium, Tampa, FL",USA,15 MAR 2024,16 MAR 2024,35,216.0,78708,39,0,78743
43,"44 Farms Team Invitational, Cushing Stadium, College Station, TX",USA,05 APR 2024,06 APR 2024,225,70.0,78479,43,0,78704
44,"Virginia Challenge, UVA Lanningan Field, Charlottesville, VA",USA,19 APR 2024,20 APR 2024,245,67.0,78430,44,0,78675
45,"39th Shizuoka International Athletics Meet, Prefectural Shizuoka Stadium, Fukuroi",JPN,03 MAY 2024,03 MAY 2024,405,44.0,78187,48,0,78592
46,"Duke Invitational, Morris Williams T&F Stadium, Durham, NC",USA,11 APR 2024,13 APR 2024,75,156.0,78500,42,0,78575
47,"Occidental Invitational, Jack Kemp Stadium, Los Angeles, CA",USA,04 MAY 2024,04 MAY 2024,340,51.0,78223,46,0,78563
48,"National Athletics Grand Prix 3, Sports Center, Bengbu",CHN,09 MAY 2024,10 MAY 2024,505,33.0,78052,52,0,78557
49,"Texas A&M Alumni Muster, Cushing Stadium, College Station, TX",USA,20 APR 2024,20 APR 2024,180,82.0,78136,50,0,78316
50,"Franson Last Chance, Cougar Athletic Stadium, Azusa, CA",USA,09 MAY 2024,11 MAY 2024,85,140.0,78211,47,0,78296
51,"National Athletics Grand Prix 1, Zhaoqing Sports Center, Zhaoqing",CHN,09 APR 2024,10 APR 2024,340,51.0,77926,57,0,78266
52,"John McDonnell Invitational, John McDonnell Field, Fayetteville, AR",USA,18 APR 2024,19 APR 2024,85,140.0,78164,49,0,78249
53,"Beach Invitational, Jack Rose Track, Long Beach, CA",USA,12 APR 2024,13 APR 2024,280,63.0,77968,55,0,78248
54,"Michael Johnson Invitational, Clyde Hart Track & Field Stadium, Waco, TX",USA,19 APR 2024,20 APR 2024,160,88.0,78039,53,0,78199
55,"Bobcat Invitational, Bobcat Track and Field Complex, San Marcos, TX",USA,28 MAR 2024,30 MAR 2024,105,123.0,78034,54,0,78139
56,"Crimson Tide Invitational, Sam Bailey Track Stadium, Tuscaloosa, AL",USA,05 APR 2024,06 APR 2024,65,163.0,78054,51,0,78119
57,"ASA Athletics Grand Prix 2, Bestmed Tuks Stadium, Pretoria",RSA,18 MAR 2024,18 MAR 2024,195,78.0,77884,58,0,78079
58,"Troféu Adhemar Ferreira da Silva Loterias Caixa de Atletismo, CNDA, Bragança Paulista",BRA,05 APR 2024,07 APR 2024,410,42.0,77626,62,0,78036
59,"Sun Belt Conference Outdoor Track and Field Championships, UL Monroe Brown Stadium, Monroe, LA",USA,09 MAY 2024,11 MAY 2024,35,216.0,77958,56,0,77993
60,"Arkansas Twilight, John McDonnell Field, Fayetteville, AR",USA,03 MAY 2024,03 MAY 2024,210,74.0,77704,59,0,77914
61,"ASA Athletics Grand Prix 1, McArthur Stadium, Potchefstroom",RSA,14 MAR 2024,14 MAR 2024,420,37.0,77488,67,0,77908
62,"Arizona Spring Break Fiesta, Univ. of Arizona Roy P. Drachman Stadium, Tucson, AZ",USA,16 MAR 2024,16 MAR 2024,140,98.0,77637,61,0,77777
63,"South Florida Invitational, University of South Florida Track & Field Stadium, Tampa, FL",USA,05 APR 2024,06 APR 2024,185,80.0,77518,66,0,77703
64,"UCF Black & Gold Invite, UCF Soccer and Track Complex, Orlando, FL",USA,15 MAR 2024,16 MAR 2024,30,233.0,77643,60,0,77673
65,"Willie Williams Classic, Univ. of Arizona Roy P. Drachman Stadium, Tucson, AZ",USA,22 MAR 2024,23 MAR 2024,80,148.0,77570,64,0,77650
66,"CAA Outdoor Track and Field Championships, Elon University’s Irwin Belk Track, Elon, NC",USA,10 MAY 2024,11 MAY 2024,10,309.0,77623,63,0,77633
67,"Clyde Hart Classic, Clyde Hart Track & Field Stadium, Waco, TX",USA,22 MAR 2024,23 MAR 2024,95,132.0,77537,65,0,77632
68,"International Track Meet, Nga Puna Wai Sports Hub, Christchurch",NZL,24 FEB 2024,24 FEB 2024,730,20.0,76829,78,0,77559
69,"3rd AK Track And Field Weekend Meeting, Nyayo National Stadium, Nairobi",KEN,26 JAN 2024,27 JAN 2024,310,54.0,77245,72,0,77555
70,"4th Alexandrino Meeting - Georgios Pantos Memorial, Municipal Sports Center, Alexandria",GRE,08 MAY 2024,08 MAY 2024,345,49.0,77191,74,0,77536
71,"Georgia Tech Invitational, Geroge C. Griffin Track, Atlanta, GA",USA,19 APR 2024,20 APR 2024,205,76.0,77281,71,0,77486
72,"Pacific Coast Invitational, Jack Rose Track, Long Beach, CA",USA,11 APR 2024,11 APR 2024,120,117.0,77353,70,0,77473
73,"Ivy League Heptagonal Outdoor Track and Field Championships, Weaver Stadium, Princeton, NJ",USA,04 MAY 2024,05 MAY 2024,30,233.0,77436,69,0,77466
74,"UIL Texas State Championships, Mike A. Myers Stadium, Austin, TX",USA,02 MAY 2024,05 MAY 2024,0,,77462,68,0,77462
75,"Sir Graeme Douglas Memorial Track Classic, Douglas Track & Field, Auckland",NZL,10 MAR 2024,10 MAR 2024,560,30.0,76891,77,0,77451
76,"Keyth Talley Invitational, LSU Bernie Moore Stadium, Baton Rouge, LA",USA,23 MAR 2024,23 MAR 2024,130,108.0,77209,73,0,77339
77,"Finales des Championnats de France des Clubs, Stade des Maradas, Cergy-Pontoise",FRA,12 MAY 2024,12 MAY 2024,490,35.0,76802,80,0,77292
78,"Jim Click Shootout & Multis, Univ. of Arizona Roy P. Drachman Stadium, Tucson, AZ",USA,05 APR 2024,06 APR 2024,130,108.0,77071,75,0,77201
79,"Hurricane Collegiate Invitational, UMiami Cobb Stadium, Coral Gables, FL",USA,23 MAR 2024,23 MAR 2024,265,66.0,76764,81,0,77029
80,"Music City Challenge, Vanderbilt Track, Nashville, TN",USA,26 APR 2024,27 APR 2024,85,140.0,76900,76,0,76985
81,"UCF Knights Invite, UCF Soccer and Track Complex, Orlando, FL",USA,22 MAR 2024,23 MAR 2024,60,172.0,76815,79,0,76875
82,"Jim Green Invitational, Un. of Kentucky Outdoor Track Facility, Lexington, KY",USA,19 APR 2024,20 APR 2024,90,135.0,76454,82,0,76544
83,"72nd Hyogo Relay Carnival, Universiade Commemorative Stadium, Kobe",JPN,20 APR 2024,21 APR 2024,330,53.0,76193,85,0,76523
84,"Clark Wood Invitational, Cardinal Park, Louisville, KY",USA,26 APR 2024,27 APR 2024,140,98.0,76370,83,0,76510
85,"UC San Diego Triton Invitational, Triton Stadium, San Diego, CA",USA,05 APR 2024,06 APR 2024,410,42.0,76077,86,0,76487
86,"2nd AK Track & Field Weekend Meeting/AK Relay Series, Ulinzi Sports Complex, Langata, Nairobi",KEN,05 JAN 2024,06 JAN 2024,105,123.0,76347,84,0,76452
87,"Puma Nitro Lange Laufnacht, Carl-Kaufmann-Stadion, Karlsruhe",GER,11 MAY 2024,11 MAY 2024,420,37.0,75828,88,0,76248
88,"Belfast Irish Milers Meet In Association with Tripadvisor, Mary Peters Track, Belfast",GBR,11 MAY 2024,11 MAY 2024,50,185.0,76017,87,0,76067
89,"Velocity Fest 15, Jamaica College Ashenheim Stadium, Kingston",JAM,20 APR 2024,20 APR 2024,300,57.0,75677,89,0,75977
90,"Cameron Burrell Alumni Invitational, Carl Lewis TF and Soccer Complex, Houston, TX",USA,06 APR 2024,06 APR 2024,305,55.0,75626,91,0,75931
91,"Aztec Invitational, San Diego State University, San Diego, CA",USA,21 MAR 2024,23 MAR 2024,270,65.0,75472,95,0,75742
92,"1. kolo extraligy mužů a žen, Stadion Juliska, Praha",CZE,11 MAY 2024,11 MAY 2024,220,72.0,75486,94,0,75706
93,"AGN League 3, Pilditch Stadium, Pretoria",RSA,10 FEB 2024,10 FEB 2024,140,98.0,75547,93,0,75687
94,"Missouri Valley Conference Outdoor Track and Field Championship, Gibson Track & Field Complex, Terre Haute, IN",USA,10 MAY 2024,12 MAY 2024,5,344.0,75652,90,0,75657
95,"The Summit League Track and Field Championships, St. Thomas O'Shaughnessy Stadium, St. Paul, MN",USA,09 MAY 2024,11 MAY 2024,10,309.0,75586,92,0,75596
96,"19. Memorial Matica Šuštaršiča in Patrika Cvetana, Športni center, Kranj",SLO,11 MAY 2024,11 MAY 2024,185,80.0,75342,98,0,75527
97,"Texas A&M Invitational, Cushing Stadium, College Station, TX",USA,23 MAR 2024,23 MAR 2024,80,148.0,75443,96,0,75523
98,"18th Spring Break Classic, Pista Basilio Rodriguez, Carolina",PUR,14 MAR 2024,16 MAR 2024,195,78.0,75318,99,0,75513
99,"Lee Last Chance, Ray Conn Sports Complex, Cleveland, TN",USA,11 MAY 2024,11 MAY 2024,20,261.0,75427,97,0,75447
100,"Internationales thallos Läufermeeting, Schönbuchstadion, Pliezhausen",GER,05 MAY 2024,05 MAY 2024,140,98.0,75276,100,0,75416
